<?xml version="1.0" encoding="UTF-8"?>
<!--
To change this license header, choose License Headers in Project Properties.
To change this template file, choose Tools | Templates
and open the template in the editor.
-->


<verificationrequests xmlns="mydomain" 
                      xmlns:xsi="http://www.w3.org/2001/XMLSchema-instance"
                      xsi:schemaLocation="mydomain verify.xsd">
    <verificationrequest>
        <transactionamount>100.0</transactionamount>
        <cardinformation cardtype="Visa">
            <cardnumber>0004-5678-1023-4567</cardnumber>
        </cardinformation>
        <ownerinformation>
            <name>bod dilly</name>
            <address>213 stream avenue, Bridgetown, Barbados</address>
        </ownerinformation>
    </verificationrequest>
    <verificationrequest>
        <transactionamount>10.0</transactionamount>
        <cardinformation cardtype="Mastercard">
            <cardnumber>6004-5678-1023-4567</cardnumber>
        </cardinformation>
        <ownerinformation>
            <name>body</name>
            <address>293 stream avenue, Bridgetown, Barbados</address>
        </ownerinformation>
    </verificationrequest>
</verificationrequests>
    
